{
 "group": "reviews-and-plans",
 "summary": "The planning, audit, and review layer of 'General Relativity, From the Inside Out' (all dated 8-9 September 2026, plus README and a design-system note). It is the project's most candid self-assessment and, for grbook.ai, probably more valuable than any single lab. It records (a) a ten-item list of scientific errors deliberately not imported from an external reference text, plus further errors found and fixed during a sentence-level manuscript pass (trace-zero matrix misdescribed as compression, a two-parameter strip called a congruence, a plane-wave coordinate wrongly called null, a dimensionally inconsistent trial displacement, one symbol reused with two dimensions); (b) a confirmed novice-sequencing failure: GR vocabulary in Chapter 0, lessons auto-placed after headings, required preparation hidden in optional tabs. It also shows the opposite failure in which pictures arrive after 22-38 displayed equations (Chapters 2, 7, 21); (c) a nine-finding comprehensive review (F01-F09) with file:line evidence, most of which were subsequently fixed and verified in the repo; (d) a visual curriculum plan with a six-step teaching pattern (observe, predict, try, compare, name and calculate, transfer), annotation specifications, release gates, and detailed specs for lettered Experiences A-C, F, and G plus an unlettered fluid lab (section 4) and stationary-action sequence (section 5). A-C shipped (the ledger calls the transport and loop increments 'implemented and pushed'), the fluid lab is partial (movable subvolume and observer boost missing), and stationary action, the gravitational lens (F), and the black-hole observer sky (G) were never built; (e) a semantic colour and typography system worth keeping; (f) curriculum architecture, prerequisite bridges, misconception diagnostics, tutor evaluation families, and a missing-subjects map (TOV stars, observational distances, Kerr/RN, Penrose/Kruskal diagrams, forms/Stokes, perturbations, QFT in curved spacetime). These documents are consistently honest about the limits of automated checks. They repeatedly insist that passing tests is not evidence that novices learn, and that learner observation plus expert review are still required.",
 "lessons_learned": [
  "SCIENCE: A homogeneous massless scalar field with zero potential has p = epsilon (stiff matter), not dust. Dust-like cycle-averaged behaviour requires oscillation in a potential such as a quadratic mass term, fast relative to expansion (reference-comparison.md error 1; fixed in Appendix E.2).",
  "SCIENCE: A curvature component times c^2 has units of 1/time^2. It is not a gravitational acceleration: you need a separation to get a relative (tidal) acceleration, and curvature says nothing about the weight of a supported observer (reference-comparison.md error 2; manuscript sections 10.9-10.10).",
  "SCIENCE: The compact small-ball volume-acceleration formula (Ricci as volume focusing) holds only for an initially comoving infinitesimal cloud, i.e. zero initial expansion, shear, and vorticity. Always state that initial-time qualification (reference-comparison.md error 3).",
  "SCIENCE: With x^0 = ct and physical (SI) action units, the Einstein-Hilbert prefactor is c^3/(16 pi G), with a matching 1/c in the matter variation. Do not write c^4/(16 pi G) without changing the measure convention (reference-comparison.md error 4).",
  "SCIENCE: With x^0 = ct, T^{0i} has units of energy density; it equals energy flux divided by c, not energy per area per time (reference-comparison.md error 5).",
  "SCIENCE: Black-hole merger area bounds that use only mass squared ignore spin; Kerr horizon area depends on spin. Present such bounds as a nonspinning ideal bound with stated limitations (reference-comparison.md error 6).",
  "SCIENCE: The focusing contribution of radiation pressure does not explain the factor of two in solar light deflection. Keep the source problem separate from exterior null propagation (reference-comparison.md error 7; Appendix E.4 is a good misconception item).",
  "SCIENCE: A thermal-looking Hawking spectrum does not prove the absence of correlations, and no-hair is not a microscopic information-erasure theorem. Also, the Euclidean-periodicity temperature argument imports quantum statistical mechanics; it does not derive outgoing Hawking flux (reference-comparison.md error 8; comprehensive review section 10.2).",
  "SCIENCE: For GPS, a clock offset times c is a ranging scale, not the receiver's position error. Operational corrections matter (reference-comparison.md error 9).",
  "SCIENCE: Avoid these overbroad slogans. Not every geodesic globally maximizes proper time (stationary is not a global maximum). Zero Ricci scalar does not imply flatness (R_abcd = 0 implies R_ab = 0 implies R = 0, with no converse). The equivalence principle alone does not establish GR. No supported (hovering) clock exists at the Schwarzschild horizon. The dimensional force scale c^4/G does not prove a universal maximum force (reference-comparison.md error 10).",
  "SCIENCE: Never reuse a symbol for quantities with different dimensions. The legacy book used script K both for the Kretschmann scalar (L^-4) and for one radial tidal component (L^-2). The fix names the component R_tidal = |R_{r0r0}| = 2GM/(c^2 r^3); for Schwarzschild, K = 48 m^2/r^6 = 12 R_tidal^2, and the length K^(-1/4) differs from R_tidal^(-1/2) by 12^(-1/4) (comprehensive review F02; fixed at book.md:3548-3554).",
  "SCIENCE: Errors found in the sentence-level pass (reading-quality-pass-2026-09-09.md, Chapters 8-13). (1) A trace-zero matrix diag(2,-1,-1) has negative unit eigenvalues that reverse vectors; this is not 'compression', and physical interpretation as acceleration is a separate step. (2) A two-parameter geodesic variation strip is not a full congruence. (3) In a plane-wave metric, both coordinate functions are not null when the inverse metric has a nonzero VV entry. (4) An oscillator trial displacement must carry an amplitude with length units; a dimensionless sine cannot be added to a position.",
  "SCIENCE: Black-hole radii must never be conflated: horizon r = 2GM/c^2, photon sphere 3GM/c^2, Schwarzschild ISCO 6GM/c^2, and distant critical impact parameter 3 sqrt(3) GM/c^2. The apparent shadow is not a photograph of the horizon sphere, and an EHT ring involves emission models and image reconstruction. Do not draw light rays rolling on Flamm's paraboloid (a spatial embedding only). A coordinate singularity must not render as light freezing (visual-development-plan section 6; comprehensive review section 9).",
  "SCIENCE: Gravitational lensing. The angular lens equation angles (beta source, theta image) are different quantities from the physical bend angle, so never share one label. The aligned 1D point-lens form is beta = theta - theta_E^2/theta, the far-field deflection approaches 4GM/(b c^2), and zero mass must give zero deflection. Ray construction, image positions, magnification, and time delay must come from one model; never pair a decorative pre-drawn curve with independently computed images (visual-development-plan Experience F).",
  "SCIENCE: Stress-energy conventions. The first index is the transport direction and the second is the quantity transported. Use Pi for spatial momentum flux. Pressure as momentum flux has the opposite sign to compressive Cauchy stress. The kinetic estimate is T^{mu nu} = (c/V) sum p^mu p^nu / p^0. A boosted density must come from Lorentz-transforming the tensor, not from changing particle velocities in the same box and simultaneity slice. An isotropic photon gas needs 3D directions to reach p = epsilon/3. Zero mean flow with nonzero pressure is the key surprise to teach (visual-development-plan section 4).",
  "SCIENCE: Parallel transport on an embedded surface obeys dV/ds = -(V . dn/ds) n. Levi-Civita transport has zero tangential change, not zero change in ambient 3D. A cylinder looks bent yet is intrinsically flat, and contractible loops on it return with zero rotation. A great-circle octant loop on the sphere gives exactly 90 degrees. Projection plus renormalization may be a convergent method but must not be advertised as exact finite transport. The surface picture is Riemannian: bridge it explicitly to Lorentzian geometry (visual-development-plan Experience C).",
  "SCIENCE: A commutator picture must not teach that noncommuting frame directions imply torsion. An anholonomic frame's Lie bracket is not torsion, so teach [X,Y] operationally first, e.g. [d_x, x d_y] = d_y, before torsion uses it (visual-development-plan section 3; comprehensive review section 5; later fixed as manuscript section 6.6).",
  "SCIENCE: Clock-rate differences and nonzero Christoffel symbols do not imply curvature. Model transfer task: ds^2 = -N(z)^2 c^2 dt^2 + dz^2 + dx^2 + dy^2, which has R = -2N''/N. N = 1 + az/c^2 is flat (Rindler); N = e^{kz} has R = -2k^2. Both have height-dependent clock rates (comprehensive review section 10.3).",
  "SCIENCE: The tidal-cloud deformation (1+2s, 1-s, 1-s) preserves volume only to first order. Relate s to proper time, s ~ GM dtau^2/(2 r^3) for the frozen leading tide, and show where that breaks down. Never claim a constant-matrix model is a full Schwarzschild congruence (comprehensive review section 11 refinements).",
  "SEQUENCING: The legacy Chapter 0 failed novices. Its first bridge used metric, interval, chart, component indices, a polar metric, and connection coefficients; it also had a proper-time integral before special relativity, polar area before polar coordinates, four-index shorthand before tensors, and relativistic expansion parameters in entry checks. The repaired measurement-led order is: position and time, velocity and acceleration, units, partial derivatives, integrals, initial-value ODEs, force and energy, calibrated matrices, flux, approximation (novice-sequencing-audit-2026-09-09.md).",